{
  "schemaVersion": "1.0.0",
  "project": {
    "name": "RS/AL volume-prescription controls",
    "subtitle": "Independent tensor controls: paired spin-half singlet has positive RS/AL volume despite zero signed mean; collinear product gives zero."
  },
  "columns": [
    {
      "key": "runId",
      "label": "Case",
      "type": "string"
    },
    {
      "key": "results.sourceGroup",
      "label": "sourceGroup",
      "type": "string",
      "precision": 8
    },
    {
      "key": "results.old_sqrt_abs_mean_proxy",
      "label": "old sqrt abs mean proxy",
      "type": "number",
      "precision": 8
    },
    {
      "key": "results.rovelli_smolin",
      "label": "rovelli smolin",
      "type": "number",
      "precision": 8
    },
    {
      "key": "results.ashtekar_lewandowski",
      "label": "ashtekar lewandowski",
      "type": "number",
      "precision": 8
    },
    {
      "key": "results.independent_tensor_product_RS",
      "label": "independent tensor product RS",
      "type": "number",
      "precision": 8
    },
    {
      "key": "results.independent_tensor_product_AL",
      "label": "independent tensor product AL",
      "type": "number",
      "precision": 8
    },
    {
      "key": "series",
      "label": "Series",
      "type": "string",
      "visible": false
    }
  ],
  "charts": {
    "type": "scatter",
    "x": "results.old_sqrt_abs_mean_proxy",
    "y": "results.old_sqrt_abs_mean_proxy",
    "groupBy": "series"
  },
  "runs": [
    {
      "runId": "volume-controls:case-0001:1",
      "task": "T1a",
      "status": "complete",
      "description": "RS/AL volume-prescription controls",
      "catalogueDate": "2026-10-09",
      "parameters": {},
      "results": {
        "sourceGroup": "paired_spin_half_singlet",
        "old_sqrt_abs_mean_proxy": 0.0,
        "rovelli_smolin": 0.3046531902363905,
        "ashtekar_lewandowski": 0.15232659511819527,
        "independent_tensor_product_RS": 0.30465319023639054,
        "independent_tensor_product_AL": 0.1523265951181952
      },
      "provenance": {
        "sourceHashes": {
          "results/volume_prescription_results.json": "9f700c0ed30169af9b1d66d2abffb78d57fb1fee5335e83ca4559c68f325ae7f"
        },
        "presentationSource": "results/volume_prescription_results.json",
        "exportRevision": "8dbd02a5be7752a4620a2586b656234801a169de",
        "exportDirtySource": true,
        "importedAt": "2026-10-15T23:52:23.831772+00:00",
        "exportCommand": "python code/python/dashboard_assets/export_numerical_data.py",
        "exporterSHA256": "20ab21990e87cf1ab38a97406ff362cc108be68f8b02c0b4ba5cffc286b6f512",
        "sourceSelector": "results.paired_spin_half_singlet"
      },
      "assessment": {
        "summary": "Independent tensor controls: paired spin-half singlet has positive RS/AL volume despite zero signed mean; collinear product gives zero.",
        "recordedStudyStatus": "Saved calculation"
      },
      "artifacts": [
        {
          "label": "volume_prescription_results.json",
          "path": "../study-assets/results/volume_prescription_results.json",
          "kind": "data",
          "sha256": "6e0e4eff7a510bc1b80ebe1c804869211daeb107ebcb93cdffd6cb710593ec26",
          "sourcePath": "results/volume_prescription_results.json",
          "sourceSha256": "9f700c0ed30169af9b1d66d2abffb78d57fb1fee5335e83ca4559c68f325ae7f"
        }
      ],
      "figures": [
        {
          "title": "Volume controls",
          "path": "../study-assets/figures/dashboard-history/volume_controls.png",
          "tags": [
            "T1a"
          ]
        }
      ],
      "series": "sourceGroup=paired_spin_half_singlet"
    },
    {
      "runId": "volume-controls:case-0002:2",
      "task": "T1a",
      "status": "complete",
      "description": "RS/AL volume-prescription controls",
      "catalogueDate": "2026-10-09",
      "parameters": {},
      "results": {
        "sourceGroup": "collinear_up_product",
        "rovelli_smolin": 0.0,
        "ashtekar_lewandowski": 0.0
      },
      "provenance": {
        "sourceHashes": {
          "results/volume_prescription_results.json": "9f700c0ed30169af9b1d66d2abffb78d57fb1fee5335e83ca4559c68f325ae7f"
        },
        "presentationSource": "results/volume_prescription_results.json",
        "exportRevision": "8dbd02a5be7752a4620a2586b656234801a169de",
        "exportDirtySource": true,
        "importedAt": "2026-10-15T23:52:23.831772+00:00",
        "exportCommand": "python code/python/dashboard_assets/export_numerical_data.py",
        "exporterSHA256": "20ab21990e87cf1ab38a97406ff362cc108be68f8b02c0b4ba5cffc286b6f512",
        "sourceSelector": "results.collinear_up_product"
      },
      "assessment": {
        "summary": "Independent tensor controls: paired spin-half singlet has positive RS/AL volume despite zero signed mean; collinear product gives zero.",
        "recordedStudyStatus": "Saved calculation"
      },
      "series": "sourceGroup=collinear_up_product"
    }
  ],
  "figures": [
    {
      "title": "Volume controls",
      "path": "../study-assets/figures/dashboard-history/volume_controls.png",
      "tags": [
        "T1a"
      ]
    }
  ],
  "docs": [
    {
      "title": "Numerical studies overview",
      "path": "../index.html"
    }
  ]
}
